,"id","url","region","region_url","price","year","manufacturer","model","condition","cylinders","fuel","odometer","title_status","transmission","VIN","drive","size","type","paint_color","image_url","description","state","lat","long","posting_date"
17439,7240586158,"https://fayar.craigslist.org/ctd/d/broken-arrow-2015-gmc-sierra-2500hd-slt/7240586158.html","fayetteville","https://fayar.craigslist.org",39995,"2015.0","gmc","sierra",,,"diesel","141455.0","clean","automatic","1GT12ZE89FF101903","4wd",,"pickup","brown","https://images.craigslist.org/00E0E_z6LVOU43sj_0jm0aT_600x450.jpg","2015 GMC Sierra 2500HD SLT Crew Cab Z71 4WD     Offered by: Jimmy Long Truck Country  — (918) 205-8936  — $39,995       Jimmy Long Truck Country     Year: 2015 Make: GMC Model: Sierra 2500HD Series: SLT Crew Cab Z71 4WD  VIN: 1GT12ZE89FF101903  Stock #: T1902 Condition: Used Mileage: 141,455  Exterior: Brown  Interior: Beige  Body: Truck  Transmission: Automatic  Engine: 6.6L V8 OHV 16V DIESEL     JIMMY LONG TRUCK COUNTRY  📲 ☎️️ CALL OR TEXT US (918) 205-8936 📲 ☎️️  WE DO WHAT WE DO FOR PEOPLE LIKE YOU! JIMMY LONG A LOCAL DEALER SINCE 1983 COME SEE US TODAY!  ✅ WE HAVE FINANCING AVAILABLE FOR MOST CREDIT SITUATIONS - CREDIT UNIONS, A VARIETY OF BANKS AND LENDING COMPANIES AVAILABLE. YOU CAN USE YOUR OWN BANK IF YOU PREFER ALSO!!    🚗 EXTENDED WARRANTIES AVAILABLE!  🚗 TRADE-INS WELCOME! 🚗 WE OFFER FREE CARFAX REPORTS TO ENSURE YOU ARE BUYING A QUALITY PRE OWNED TRUCK!  🚗 FILL OUT A CREDIT APPLICATION BELOW AND GET PRE APPROVED EASILY! https://ssl-wwwtruckcountry7777com.dcs-cms.com/creditapp.aspx?  🚗 TO VIEW ALL OF OUR INVENTORY PLEASE FOLLOW THE LINK BELOW: http://www.truckcountry7777.com/newandusedcars.aspx?clearall=1    More vehicle details: www.jimmylongtruckcountryok.com/v/g1og4ZYX  Address: 8943 S Highway 51 Broken Arrow, OK 74014 Phone: (918) 205-8936  Website: truckcountry7777.com/      📲 ☎️ Call or text (918) 205-8936 for quick answers to your questions about this GMC Sierra 2500HD Your message will always be answered by a real human — never an automated system.     Disclaimer: Jimmy Long Truck Country  will never sell, share, or spam your mobile number. Standard text messaging rates may apply. Information deemed reliable, but not guaranteed. Interested parties should confirm all data before relying on it to make a purchase decision. All prices and specifications are subject to change without notice. Prices may not include additional fees such as government fees and taxes, title and registration fees, finance charges, dealer document preparation fees, processing fees, and emission testing and compliance charges.
       2015 GMC Sierra 2500HD SLT Crew Cab Z71 4WD  6e1f54fdc0904cae8b8e1efd507b8953","ar","36.047568","-95.753332","2020-12-02T13:39:50-0600"
17440,7240585819,"https://fayar.craigslist.org/ctd/d/lowell-2012-subaru-impreza-wrx-several/7240585819.html","fayetteville","https://fayar.craigslist.org",18900,"2012.0","subaru","impreza wrx",,,"gas","105034.0","clean","manual","JF1GV8J61CL023149",,,,"black","https://images.craigslist.org/00H0H_iK7E7nKZaJN_0cU09G_600x450.jpg","2012 SUBARU WRX STI AWD...... BEAUTIFUL RIDE..... IT HAS SEVERAL UPGRADES....... EQUIPED WITH INVIDIA AFTER MARKET EXHAUST SYSTEM STAGE 2 TUNER, STAGE2 COBB AIR INTAKE, AFTER MARKET HEADERS, AND MUCH MORE..... REDAY TO GO..... A SUPER NICE RIDE. IT'S LOADED WITH EVERYTHING YOU NEED TO ENJOY THIS RIDE... GREAT MILES... A MUST HAVE.... COME TEST DRIVE THIS ONE AND YOU WILL LOVE IT. GIVE US A CALL TODAY TO DISCUSS OUR GUARANTEED FINANCING. WE COUNT WITH SEVERAL FINANCE COMPANIES AND BANKS READY TO FINANCE REGARDLESS THE CREDIT. WE HAVE THE FRIENDLIEST SALES STAFF AROUND, SO LET US PUT YOU IN THE CAR YOU DESERVE. FOR MORE INFO ON THIS VEHICLE AND OTHERS LIKE IT GO TO BAGWELLMOTORS.COM OR CALL OFFICE 479-419-9447 OR CALL/TEXT DANIEL 479-268-0664 THANKS  ++ DON'T FORGET ABOUT OUR REFERRAL PROGRAM AND WIN UP TO $500!!!  ++ DON'T FORGET ABOUT OUR SHOP WE HAVE WE CAN SERVICE YOUR TRUCK OR CAR JUST GIVE THEM A CALL TO SCHEDULE AN APPOINTMENT 479-347-2736 ++","ar","36.2554","-94.1308","2020-12-02T13:39:19-0600"
17441,7240585773,"https://fayar.craigslist.org/ctd/d/broken-arrow-2014-chevrolet-chevy/7240585773.html","fayetteville","https://fayar.craigslist.org",29995,"2014.0","chevrolet","silverado",,,"diesel","239399.0","clean","automatic","1GC1KYE80EF107095","4wd",,"pickup","black","https://images.craigslist.org/00707_6YhPBcvEwbO_0jm0ew_600x450.jpg","2014 Chevrolet Chevy Silverado 2500HD LTZ Crew Cab Z71 4X4     Offered by: Jimmy Long Truck Country  — (918) 205-8936 — $29,995       Jimmy Long Truck Country     Year: 2014 Make: Chevrolet Model: Silverado 2500HD Series: LTZ Crew Cab Z71 4X4 VIN: 1GC1KYE80EF107095 Stock #: T1899 Condition: Used Mileage: 239,399  Exterior: Black Interior: Black Body: Truck Transmission: Automatic Engine: 6.6L V8 OHV 32V TURBO DIESEL      JIMMY LONG TRUCK COUNTRY  📲 ☎️️ CALL OR TEXT US (918) 205-8936 📲 ☎️️  WE DO WHAT WE DO FOR PEOPLE LIKE YOU! JIMMY LONG A LOCAL DEALER SINCE 1983 COME SEE US TODAY!  ✅ WE HAVE FINANCING AVAILABLE FOR MOST CREDIT SITUATIONS - CREDIT UNIONS, A VARIETY OF BANKS AND LENDING COMPANIES AVAILABLE. YOU CAN USE YOUR OWN BANK IF YOU PREFER ALSO!!    🚗 EXTENDED WARRANTIES AVAILABLE!  🚗 TRADE-INS WELCOME! 🚗 WE OFFER FREE CARFAX REPORTS TO ENSURE YOU ARE BUYING A QUALITY PRE OWNED TRUCK!  🚗 FILL OUT A CREDIT APPLICATION BELOW AND GET PRE APPROVED EASILY! https://ssl-wwwtruckcountry7777com.dcs-cms.com/creditapp.aspx?  🚗 TO VIEW ALL OF OUR INVENTORY PLEASE FOLLOW THE LINK BELOW: http://www.truckcountry7777.com/newandusedcars.aspx?clearall=1        More vehicle details: www.jimmylongtruckcountryok.com/v/GAnXxnTA     Address: 8943 S Highway 51 Broken Arrow, OK 74014   Phone: (918) 205-8936     Website: truckcountry7777.com/      📲 ☎️ Call or text (918) 205-8936 for quick answers to your questions about this Chevrolet Silverado 2500HD Your message will always be answered by a real human — never an automated system.     Disclaimer: Jimmy Long Truck Country  will never sell, share, or spam your mobile number. Standard text messaging rates may apply. Information deemed reliable, but not guaranteed. Interested parties should confirm all data before relying on it to make a purchase decision. All prices and specifications are subject to change without notice. Prices may not include additional fees such as government fees and taxes, title and registration fees, finance charges, dealer document preparation fees, processing fees, and emission testing and compliance charges.
       2014 Chevrolet Silverado 2500HD LTZ Crew Cab Z71 4X4   b7f10f0b7a0d463e9763c98fe9ee1f2b","ar","36.047568","-95.753332","2020-12-02T13:39:16-0600"
